{
    "x_build_size" : 200,
    "y_build_size" : 200,

    "kerf" : 0.05,

    "switch_type": "mx_openable",
    "stabilizer_type": "cherry",

    "custom_shape": false, 
    "custom_shape_points": null,
    "custom_shape_path": null,
    
    "plate_supports": true,
    "support_bar_height" : 3.0,
    "support_bar_width" : 3.0,    

    "top_margin" : 0,
    "bottom_margin" : 0,
    "left_margin" : 0,
    "right_margin" : 0,

    "case_height" : 20,
    "case_wall_thickness" : 3.0,
    "plate_thickness" : 1.111,
    "plate_corner_radius" : 4,
    "bottom_cover_thickness": 2,

    "tilt": 5,

    "screw_count": 0,
    "screw_diameter": 4,
    "screw_edge_inset": 7,

    "cable_hole": false,
    "cable_hole_width": 10,
    "cable_hole_height": 10,
    "cable_hole_down_offset": 1
}