{
    "plate_supports": true,

    "stabilizer_type": "costar",
    
    "x_build_size" : 80,
    "y_build_size" : 80,

    "kerf" : 0.05,

    "top_margin" : 0,
    "bottom_margin" : 0,
    "left_margin" : 0,
    "right_margin" : 0,
    "case_height" : 10,
    "case_wall_thickness" : 3.0,
    "plate_thickness" : 1.311,
    "plate_corner_radius" : 4,

    "support_bar_height" : 3.0,
    "support_bar_width" : 3.0,

    "tilt": 5,

    "cable_hole": true,
    "cable_hole_up_offset": 0,
    "cable_hole_down_offset": 1,
    "cable_hole_width": 10,
    "cable_hole_height": 5,

    "screw_count": 0,
    "screw_diameter": 4,
    "screw_edge_inset": 7,

    "bottom_cover_thickness": 2,

    "simple_test": false
}